{
  "schemaVersion": "praxis-protocol/v1",
  "policyId": "policy-canonical-1",
  "blastRadius": "repo",
  "effectClasses": {
    "reversible": { "allowed": true, "requiresCompensationPlan": false, "maxSteps": 100 },
    "compensable": { "allowed": true, "requiresCompensationPlan": true, "maxSteps": 10 },
    "irreversible": { "allowed": true, "requiresCompensationPlan": true }
  },
  "authority": {
    "requiredIdentityId": "human-approver-1",
    "humanApprovalRequired": true
  },
  "scope": {
    "allowedGlobs": ["src/**"],
    "forbiddenGlobs": ["**/*.env"]
  },
  "commands": {
    "exactAllowed": ["bun test", "bun run typecheck"],
    "hardDenied": ["rm -rf /"]
  }
}
